{"argument_graph_id":"nf-4db338dcf09d3c6644542c152ab42289","classification":"true_conflict","confidence":0.95,"conflict_id":"nf-36d2e8fcebfd163cfe9c70a9821f1f88","conflict_type":"norm_contradiction","human_review_question_en":"In sepsis treatment, the beta-lactam recommendation conflicts with the contraindication. Please verify the priority for patients with allergy history.","human_review_question_ja":"敗血症治療において、βラクタム系抗菌薬の推奨と禁忌が矛盾しています。アレルギー既往患者への優先順位を確認してください。","minimal_artifact_set":["sha256:57185d637009477b57d7e9155da1a2b6e64dacf5a17b31fed74210cce929abfb","sha256:b017ada0227620559bc998a0df7541019d94df7764745faa06dd9112aea76e7d","sha256:cb074f316e1796e2ca83a874a0a28cf3bb306c668af89856da384e470e800eff","sha256:f7915e2269ee56e0eb1f871e7727a388b095f6bedbb31fab82c578a6d674ec28"],"normalized_view":{"rule_contraindicate":{"action":"administer beta_lactam","direction":"against","rule_id":"rule_bl_anaphylaxis_contra","strength":"strong"},"rule_recommend":{"action":"administer beta_lactam","direction":"for","rule_id":"rule_sepsis_bl_recommend","strength":"strong"},"shared_context":"(dx sepsis) AND (allergy_history beta_lactam anaphylaxis)"},"repair_candidates":[{"exception":"beta_lactam_anaphylaxis","rationale":"Exclude allergy patients from recommendation scope","rule":"rule_sepsis_bl_recommend","type":"add_exception"},{"rationale":"Absolute contraindication overrides recommendation","superior":"rule_bl_anaphylaxis_contra","type":"add_priority"}],"severity":"high","solver_evidence":[{"description":"Shared context satisfiable: patient with sepsis AND beta-lactam anaphylaxis history exists","encoding":"smt2","solver":"z3","status":"sat"}],"source_spans":["span_contra_bl_allergy","span_rec_sepsis_bl"],"witness":"nf-7260b8bcfb273c6ea1a5764faa86f46d"}