{"argument_graph_id":"nf-4db338dcf09d3c6644542c152ab42289","classification":"true_conflict","confidence":0.92,"conflict_id":"nf-739a255b7a7336ba8966f25d3e9df18f","conflict_type":"temporal_violation","human_review_question_en":"Event Calculus shows allergy_known persists from detection (t=0) to drug administration (t=10), detecting administration under active contraindication.","human_review_question_ja":"イベント計算により、アレルギー歴(t=0)から薬剤投与(t=10)まで allergy_known が持続し、禁忌状態での投与が検出されました。","minimal_artifact_set":["sha256:97498841407d0e56398a8afeabb309a957af3590c6a829de70a7a50af73fc582"],"normalized_view":{"event_calculus":{"happens_administer_drug_t10":true,"happens_detect_allergy_t0":true,"holds_allergy_known_t10":true,"initiates_allergy_known_t0":true,"no_terminating_event_before_t10":true,"violation":"Drug administered at t=10 while allergy_known holds (contraindication active)"}},"repair_candidates":[{"action":"administer_drug","guard":"NOT holds(allergy_known, t)","rationale":"Administration must check allergy status before proceeding","type":"add_temporal_guard"}],"severity":"high","solver_evidence":[{"description":"EC stable model confirms allergy_known persists from t=0 to t=10 with no terminating event","encoding":"asp","models":1,"solver":"clingo","status":"SAT"}],"source_spans":["span_allergy_history","span_contra_bl_allergy","span_rec_sepsis_bl"],"witness":"nf-bd369feba5135e447b283223023f6fa4"}