{"classification":"true_conflict","confidence":0.9,"conflict_id":"nf-7fe1a248a7dc7864de5242aed68f70d3","conflict_type":"decision_table_overlap","human_review_question_en":"In the vital-sign assessment table, temperatures >= 38.5 match both row 0 (antipyretic) and row 1 (cooling). Unique hit policy requires exactly one matching row.","human_review_question_ja":"バイタルサイン評価表で、体温38.5°C以上のとき行0(解熱薬投与)と行1(冷却処置)の両方に該当します。Unique方針では1行のみ一致する必要があります。","minimal_artifact_set":["sha256:37aac2dbd4ecd2242ce8113a6559cc061c161efcbbdedcc9ce5b9693c3181700"],"normalized_view":{"gap_witness":{"heart_rate":85,"matched_rows":0,"systolic_bp":95,"temperature":37.5},"hit_policy":"unique","overlap":{"output_a":"administer_antipyretic","output_b":"initiate_cooling","row_a":"row_temp_high","row_b":"row_temp_very_high","shared_condition":"temperature >= 38.5"},"table_id":"dt_vitals_triage"},"repair_candidates":[{"from":"unique","rationale":"Allow ordered evaluation with priority","to":"priority","type":"change_hit_policy"},{"new_condition":"38.0 <= temperature < 38.5","rationale":"Make rows mutually exclusive","row":"row_temp_high","type":"refine_condition"}],"severity":"medium","solver_evidence":[{"description":"Overlap witness: temperature=38.7 satisfies both row_temp_high (>=38.0) and row_temp_very_high (>=38.5)","encoding":"smt2","solver":"z3","status":"sat"}],"source_spans":["span_cell_r0c0","span_cell_r0c1","span_cell_r1c0","span_cell_r1c1"],"witness":"nf-c4b368669f4edef17dcfad4e7251d84d"}