{"argument_graph_id":"ag_bl_001","classification":"true_conflict","confidence":0.95,"conflict_id":"conflict_bl_001","conflict_type":"norm_contradiction","human_review_question_en":"Recommendation and contraindication conflict","human_review_question_ja":"推奨と禁忌が矛盾しています","minimal_artifact_set":["sha256:aa00000000000000000000000000000000000000000000000000000000000001"],"normalized_view":{"type":"norm_contradiction"},"repair_candidates":[{"type":"add_priority"}],"severity":"high","solver_evidence":[{"solver":"z3","status":"sat"}],"source_spans":["span_gl_s1","span_gl_s2"],"witness":"witness_conflict_001"}