[{"argument_graph_id":"ag_sepsis_bl_conflict","classification":"true_conflict","confidence":0.95,"conflict_id":"conflict_norm_bl_contradiction","conflict_type":"norm_contradiction","human_review_question_en":"In sepsis treatment, the beta-lactam recommendation conflicts with the contraindication. Please verify the priority for patients with allergy history.","human_review_question_ja":"敗血症治療において、βラクタム系抗菌薬の推奨と禁忌が矛盾しています。アレルギー既往患者への優先順位を確認してください。","minimal_artifact_set":["sha256:a001000000000000000000000000000000000000000000000000000000000001","sha256:a001000000000000000000000000000000000000000000000000000000000002"],"normalized_view":{"rule_contraindicate":{"action":"administer beta_lactam","direction":"against","rule_id":"rule_bl_anaphylaxis_contra","strength":"strong"},"rule_recommend":{"action":"administer beta_lactam","direction":"for","rule_id":"rule_sepsis_bl_recommend","strength":"strong"},"shared_context":"(dx sepsis) AND (allergy_history beta_lactam anaphylaxis)"},"repair_candidates":[{"rationale":"Absolute contraindication overrides recommendation","superior":"rule_bl_anaphylaxis_contra","type":"add_priority"},{"exception":"beta_lactam_anaphylaxis","rationale":"Exclude allergy patients from recommendation scope","rule":"rule_sepsis_bl_recommend","type":"add_exception"}],"severity":"high","solver_evidence":[{"description":"Shared context satisfiable: patient with sepsis AND beta-lactam anaphylaxis history exists","encoding":"smt2","solver":"z3","status":"sat"}],"source_spans":["span_rec_sepsis_bl","span_contra_bl_allergy"],"witness":"witness_norm_conflict"},{"classification":"true_conflict","confidence":0.9,"conflict_id":"conflict_dt_vitals_overlap","conflict_type":"decision_table_overlap","human_review_question_en":"In the vital-sign assessment table, temperatures >= 38.5 match both row 0 (antipyretic) and row 1 (cooling). Unique hit policy requires exactly one matching row.","human_review_question_ja":"バイタルサイン評価表で、体温38.5℃以上のとき行0（解熱薬投与）と行1（冷却処置）の両方に該当します。Unique方針では1行のみ一致する必要があります。","minimal_artifact_set":["sha256:a002000000000000000000000000000000000000000000000000000000000001"],"normalized_view":{"gap_witness":{"heart_rate":85,"matched_rows":0,"systolic_bp":95,"temperature":37.5},"hit_policy":"unique","overlap":{"output_a":"administer_antipyretic","output_b":"initiate_cooling","row_a":"row_temp_high","row_b":"row_temp_very_high","shared_condition":"temperature >= 38.5"},"table_id":"dt_vitals_triage"},"repair_candidates":[{"new_condition":"38.0 <= temperature < 38.5","rationale":"Make rows mutually exclusive","row":"row_temp_high","type":"refine_condition"},{"from":"unique","rationale":"Allow ordered evaluation with priority","to":"priority","type":"change_hit_policy"}],"severity":"medium","solver_evidence":[{"description":"Overlap witness: temperature=38.7 satisfies both row_temp_high (>=38.0) and row_temp_very_high (>=38.5)","encoding":"smt2","solver":"z3","status":"sat"}],"source_spans":["span_cell_r0c0","span_cell_r0c1","span_cell_r1c0","span_cell_r1c1"]},{"argument_graph_id":"ag_sepsis_bl_conflict","classification":"true_conflict","confidence":0.92,"conflict_id":"conflict_ec_allergy_persistence","conflict_type":"temporal_violation","human_review_question_en":"Event Calculus shows allergy_known persists from detection (t=0) to drug administration (t=10), detecting administration under active contraindication.","human_review_question_ja":"イベント計算により、アレルギー歴（t=0）から薬剤投与（t=10）まで allergy_known が持続し、禁忌状態での投与が検出されました。","minimal_artifact_set":["sha256:a003000000000000000000000000000000000000000000000000000000000001","sha256:a003000000000000000000000000000000000000000000000000000000000002"],"normalized_view":{"event_calculus":{"happens_administer_drug_t10":true,"happens_detect_allergy_t0":true,"holds_allergy_known_t10":true,"initiates_allergy_known_t0":true,"no_terminating_event_before_t10":true,"violation":"Drug administered at t=10 while allergy_known holds (contraindication active)"}},"repair_candidates":[{"action":"administer_drug","guard":"NOT holds(allergy_known, t)","rationale":"Administration must check allergy status before proceeding","type":"add_temporal_guard"}],"severity":"high","solver_evidence":[{"description":"EC stable model confirms allergy_known persists from t=0 to t=10 with no terminating event","encoding":"asp","models":1,"solver":"clingo","status":"SAT"}],"source_spans":["span_allergy_history","span_contra_bl_allergy","span_rec_sepsis_bl"],"witness":"witness_norm_conflict"}]
